[
  {
    "user_input": "Do we have a candidate with experience in hydraulic components that meet military and FAA regulations?",
    "retrieved_contexts": [
      "10030015 \u00b7 ENGINEERING - Assembled rockets, bombs, and small arms for Operation Enduring Freedom. Train newly assigned personnel at Line Delivery section on transporting, loading, and delivering munitions to aircraft. Skills DasyLab, Labview, Mechanical, Electrical, Lean/5S, Hydraulic Testing, Test Stand Fabrication Education and Training Associates , Applied Science Electronics Engineering 2011 Forsyth Technical Community College \u00ef\u00bc\u200b City , State Applied Science Electronics Engineering Associates , Applied Science, Munitions Systems Technology 2007 Community College of the Air Force \u00ef\u00bc\u200b City , State Applied Science, Munitions Systems Technology",
      "10219099 \u00b7 ENGINEERING - Assist in candidate selection as requested. Maintain departmental records Maintain spare parts inventory. Identify and order needed parts, maintain tracking system. Perform other duties as assigned by the Supervisor and Manager. Mechanical Technician 04/2013 to 05/2014 Company Name \u00e2\u20ac\u201c City , State Implement repair services on all production equipment, auxiliary equipment and building equipment using hand tools, testing tools, manual drawings, computer and any other tools necessary to accomplish the task. Provide reliable, high quality customer support through on-site inspecting, installing, repairing and/or replacing fire alarm equipment as well as conducting preventive maintenance services pertaining to many different manufacturers equipment. Ensure conveyor belts working effectively Operating Engineer / Test Technician 11/2007 to 06/2012 Company Name \u00e2\u20ac\u201c City , State Operates, repair and maintain Facility/Plant Machinery, Test Equipment, Lubrication and Cooling Systems and High Pressure Systems for NASA unitary Wind Tunnels. Constructs, modifies, maintains and services wind and propulsion tunnel research facilities used to test models of aircraft components, utilizing knowledge of engineering test methods and procedures. Installs and aligns mechanical hydraulic and pneumatic test equipment and models on support structures. Installs instrumentation, thermocouples and pressure taps on model and test equipment. Inspects test setup and operates equipment to detect and correct malfunctions. Maintains instrumentation equipment and accessories for pressure valves, icing indicators, drive units, spray units, and pumps. Confers with engineering and other personnel during testing and modifies model, test support structure, or test equipment as directed. Inspect, test, and install fire sprinkler systems, standpipe systems, fire pumps, and clean agent systems at various industrial, commercial and institutional facilities in accordance with various codes. Perform inspections, test and repair/replace fire hoses and fire hydrants. Generate reports based on inspection findings. Logistics Coordinator / Sr. Lab technician 10/2006 to 11/2007 Company Name \u00e2\u20ac\u201c City , State Coordinates all incoming and outgoing shipments of solar arrays, panels, shipping containers and ground support equipment. Interfaces with Metrology personnel to ensure calibrated equipment needs are prioritized and maintains inventory of the Section's calibrated equipment. Supports work in progress, troubleshoots manufacturing problems caused by test equipment. Coordinates proof loading and non-destructive testing of lifting fixtures and handling equipment. Maintains inventory of industrial supplies. Disposes of hazardous materials and coordinates area compliance.",
      "10030015 \u00b7 ENGINEERING - ENGINEERING LAB TECHNICIAN Career Focus My main objective in seeking employment with Triumph Actuation Systems Inc. is to work in a professional atmosphere where I can utilize my skills and continue to gain experience in the aerospace industry to advance in my career. Professional Experience Engineering Lab Technician Oct 2016 to Current Company Name \u00ef\u00bc\u200b City , State Responsible for testing various seat structures to meet specific certification requirements. \u00c2 Maintain and calibrate test instruments to ensure testing capabilities are maintained. Ensure data is captured and recorded correctly for certification test reports. Duties also dynamic test set-up and static suite testing. Engineering Lab Technician, Sr. Specialist Apr 2012 to Oct 2016 Company Name \u00ef\u00bc\u200b City , State Utilized skills learned from LabView Course 1 training to construct and maintain LabView VI programs. Responsible for fabricating and maintaining hydraulic/electrical test equipment to complete development and qualification programs. Apply engineering principles to operate electrical, mechanical, and hydraulic systems to test pumps, motors, and actuators for aircraft. Work closely with Design Engineers and Lab Management to investigate performance/design issues. Completed Lean Six Sigma/5s training seminar. Assembly/ Test Technician Mar 2007 to Mar 2012 Company Name \u00ef\u00bc\u200b City , State Lead technician overseeing three member crew responsible for maintaining high quality standards in a high volume production environment. Responsible for cargo door system actuators for Boeing 787 aircraft. Experience with hydraulic components that meet military and FAA regulations. Work closely with Engineering Group and Quality Assurance inspectors to resolve problems with development actuators. Munitions Systems Journeyman Mar 2003 to Mar 2007 Company Name \u00ef\u00bc\u200b City , State Responsible for certifying small arms, actuation devices, bombs, rockets and other munitions items. Supervised work crews of 3-5 men while supporting USAF aircraft during Operation Enduring Freedom. Assembled rockets, bombs, and small arms for Operation Enduring Freedom. Train newly assigned personnel at Line Delivery section on transporting, loading, and delivering munitions to aircraft.",
      "10219099 \u00b7 ENGINEERING - EQUIPMENT ENGINEERING TECHNICIAN Professional Summary Skilled\u00c2 Maintenance Mechanic\u00c2 Technician with superb problem solving and multi-tasking skills. Self-directed and motivated worker. To obtain a position where Teamwork, Integrity and Proffesionalism are a high standard in the Company's Mission Statement. All while engaing in new challenges and learning experiences. Skills \u00c2\u00b7\u00c2 \u00c2 20 years of Material Management experience\u00c2 with State and Federal Government \u00c2\u00b7 13 years of Law Enforcement experience with the United States Marine Corps and Army National Guard. \u00c2\u00b7\u00c2 Knowledge of mechanical test equipment. \u00c2\u00b7 Work from written/verbal instructions, schematics, rough sketches, troubleshooting diagrams, layouts and plans, interpretation and application of technical knowledge and understanding of mechanical theory and principles. \u00c2\u00b7 Proficient in the use of PC's, MS\u00c2 office, 10key by touch and Customer Service skills. \u00c2\u00b7\u00c2 Forklift and Crane Certified \u00c2\u00b7\u00c2 Self motivated to Lead and Achieve Company goals with excellence, integrity and efficiency. \u00c2\u00b7 NDT Level II \u00c2 \u00c2\u00b7 Knowledge on mechanical, pneumatic and hydraulic theory and principles\u00c2 \u00c2 Work History Equipment Engineering Technician 05/2014 to Current Company Name \u00e2\u20ac\u201c City , State Responsibility for designing/selecting robotic systems, run simulation, implementation, commission and programming. Support and assist maintenance team in troubleshooting difficult breakdowns and chronic equipment failures. Conduct the installation of factory automation and electrical control systems for manufacturing equipment Provide Troubleshooting of electrical systems in plant manufacturing equipment Provide effective direction, coaching, and OJT to fellow employees on shift to boost their skill sets, and help Production achieve their goals. Plan and organize between shift and weekend work, including verification, for smooth operations. Assist the Supervisor in developing PMs and procedures for maintaining all of the equipment in the shop. Provide shift- to-shift communication in order to keep all associates up to speed and working toward the same goals. Set an example, and ensure that all associates comply with safety regulations and the plant's safety program. Work with engineers and fellow technicians to resolve technical problems. Assist in candidate selection as requested. Maintain departmental records Maintain spare parts inventory. Identify and order needed parts, maintain tracking system. Perform other duties as assigned by the Supervisor and Manager.",
      "12022566 \u00b7 ENGINEERING - ENGINEERING INTERN Summary Candidate with a fifteen months experience in production supervising and manufacturing seeking opportunity in field of Quality, Supply Chain and Manufacturing Highlights DMAIC, Failure Modes and Effective Analysis (FMEA), Kaizen, Lean Manufacturing , 5S, Value Stream Mapping, Root Cause Analysis, PFMEA Quality tools: Statistical Process Control, Process Capability, ANOVA, Gage R & R Software: Programmable Logic controls (PLC), Discrete Control system (DCS), Microsoft office, Minitab, Pro-E, Working knowledge of Auto-Cad , C++, C, Visual Basics, Process flow diagram Accomplishments Manufacturing a 9 Volt battery with minimum process variability and cost of production Jan 2014 - April 2014 Designed statistical experiment to derive significant factors in manufacturing a baking soda based 9V battery Analyzed the voltage readings to achieve 9V with little variation possible by adjusting factors and at low cost using ANOVA, Fractional factorial, Central composite design, cost analysis, T- tests, Path of steepest ascent Applied statistical process control tools to check whether the process is in-control Used Capability analysis to compare actual process performance to the performance standards established by customers. Implementing quality assurance tools like method of steepest ascent, response surface modelling, statistical process control, process capability analysis to achieve the continuous production of consistent output 9V batteries Achieved results with minimum process variability at least possible cost Supply Chain Management and Initiatives at AMUL Diary Sept 2013 - Dec 2013 Studied and analyzed the Supply Chain of AMUL Diary and suggested improvements in their Supply Chain Management to maximize the profit Analyzed the role of information in the Supply Chain of AMUL diary such as EIAS,GIS,DISK Advantages of E-initiative Suggested financial implications such as improve logistics transportation through integrated Railway system."
    ],
    "response": "Yes, the candidate in Resume 10030015 has experience with hydraulic components that meet military and FAA regulations. They worked as an Assembly/Test Technician from March 2007 to March 2012, where they were responsible for cargo door system actuators for Boeing 787 aircraft and gained experience with hydraulic components meeting military and FAA regulations.",
    "reference": "Resume 10030015 (ENGINEERING) includes a candidate with experience in hydraulic components that meet military and FAA regulations.",
    "faithfulness": 1.0,
    "answer_relevancy": 0.8099277545251112,
    "context_precision": 0.5833333333041666,
    "context_recall": 1.0
  },
  {
    "user_input": "Do we have a candidate with CompTIA Network certification achieved?",
    "retrieved_contexts": [
      "11957080 \u00b7 INFORMATION-TECHNOLOGY - Trained others to manipulate the database for creating custom reports for their departments. Served as network administrator. Diagnosed and implemented solutions for routine hardware issues. Edited weekly publications including the Lantern Newsletter. Prepared special publication projects. Education and Training May, 2002 B.S : Business Administration, Management Information Systems California State University \u00ef\u00bc\u200b City Business Administration, Management Information Systems Cum Laude December, 2008 Microsoft Word XP Certification, Microsoft Office Specialist Program May, 2003 Crystal Certification of Crystal Reports Design 9.0 April, 2005 New Horizons Course: OLL - Developing MS ASP .NET Web Applications Using Visual Studio October, 2007 Novell Certificate in Implementing Novell Open Enterprise Server 2 for Linux Graduate Certificate in Corporate Education August, 2009 Pearson VUE Certified Test Administrator May, 2010 Siemon Certification in Design Principles and Installation Practices December, 2011 FrontRange HEAT Administration I November, 2013 FrontRange HEAT Administration II February, 2014 Dell Certification for Online Self Dispatch for Desktops and Notebooks June, 2015 Activities and Honors Driven Information Technology Professional with broad technical skill set. Known for ability to multi-task and juggle multiple projects simultaneously, meeting all deadlines. Excels in customer support, training, and documentation. Most noted for customer service and teamwork expertise. Thrives in environments that continually embraces new technologies. Skills ASP .NET, Client/Server, Crystal Reports, data analysis, Database design, database software, Desktop Publishing, Desktop Publisher, equipment inventory, special events, Front Office, help desk, HTML web design, in Design, instruction, Linux, Logging, macros, Publisher, network administrator, Newsletter, procurement, repairs, SAP R/3, software installation, SQL, systems administration, technical support, training material, tutoring, UNIX, Visual Studio, Web Applications, web server",
      "10641230 \u00b7 INFORMATION-TECHNOLOGY - IT MANAGEMENT Career Overview Detail-oriented professional with extensive Information Technology experience in hardware and software troubleshooting/management. With additional experience in networking, task automation, server technologies, digital graphic design, client + server side programming technologies and popular industry software packages including Microsoft Office and Adobe Creative Suite. Qualifications Education and certificates Troubleshooting q CompTIA A+ certified (2012) q Advanced troubleshooting q CompTIA Net+ certification class q Virus and spyware removal q MCSA certification class q Computer diagnostics and repair q Web Development I + II class q Gaming console repair and q Digital media manipulation class modification q Java programming class q Mobile device repair q Hardware support and Programming and Web troubleshooting q HTML - HTML5 q Optimizing and performance tuning q XML q Audio and video technologies q CSS - CSS3 q Medical technology installation and q JavaScript troubleshooting q Command Line q Java Management q ActionScript q Hardware and software upgrade q PHP planning q Database servers q Documentation q Android mobile application q Organization development q Multi-project priority management q Content Management Systems (CMS) Operating Systems q Website enhancement q Windows 95 - 8 q Storyboarding q Windows Server 2003 - 8 q Search Engine Optimization (SEO) q Windows Phone 7.0 - 8.0 q Social Media and marketing q Multiple Linux Distributions q Ubuntu 10.04 LTS - 12.10 Networking q Android 1.0 - 4.0.4 q Cloud computing q Mac OS X v10.0 - v10.8 q Server management q IOS 1.0 - 6.1 q Active directory q Remote connection technologies Programs q Proficiency in numerous protocols q Microsoft Office 2010 including TCP/IP q Small business management q Information security software (client and server) q Wireless technologies q Adobe Creative Suite 5 q Telephony technologies q Wiring and Network engineering Graphics and Media q Photo enhancing Electronics q Brochure and newsletter formatting q Electronic circuits and components q Audio and video editing q Circuit diagrams and Prototyping q Logo and business card q Logic, electronic and computational algorithms q Electromagnetisms and waves q Quantum particle mechanics q As well as many miscellaneous IT q Energy and electrical alternatives skills. (Solar) Accomplishments Rebuilt a client's website from the ground up and increased monthly hits from 3422 to 40884 in a matter of a few months.",
      "10641230 \u00b7 INFORMATION-TECHNOLOGY - May 2011 to July 2011 Company Name \u00ef\u00bc\u200b City , State In charge of company website management, social media administration, as well as assisting in administrative tasks. Education and Training Associate of Science : Information Technology , 2014 Lyons Township \u00ef\u00bc\u200b City , State , United States Information Technology High School Diploma General Education Coursework in computer science all 4 years GPA: Diamond Achievement Academic award * Honor Roll Diamond Achievement Academic award * Honor Roll Skills A+ certified, ActionScript, Active directory, administrative, Adobe Creative Suite 5, Photo, Audio, Brochure, budgeting, business management, client and server, CMS, Hardware, computer repair, consulting, Content Management, CSS, CSS3, client, Database, designing, Documentation, Electronics, XML, Graphics, Hardware support, HTML, HTML5, PHP, Information security, Java, Java programming, JavaScript, Linux, Logic, Logo, Mac OS, managing, marketing, Medical technology, Microsoft Office, office, Windows, Windows 95, Network engineering, network, Networking, newsletter, Operating Systems, Organization development, Programming, protocols, Prototyping, Search Engine Optimization, servers, Storyboarding, TCP/IP, Telephony, Phone 7.0, Troubleshooting, upgrade, video, video editing, Web Development I, Website, website management, Windows Server, Wiring",
      "11580408 \u00b7 INFORMATION-TECHNOLOGY - INFORMATION TECHNOLOGY COORDINATOR Career Overview AVP / Director of Information Technology I Network Engineer with extensive experience. Strengths - excellent communication skills, strong problem solving skills. Sound work ethic, capable of working independently or in a team environment. Highly professional with the ability to set and maintain priorities. Qualifications Certifications and Certificates: \u00e2\u20ac\u00a2 Microsoft Certified Professional \u00e2\u20ac\u00a2 Comp-TA A+ Certified \u00e2\u20ac\u00a2 Microsoft SOL 2000 Design and Administration \u00e2\u20ac\u00a2 Microsoft Access I. II. III \u00e2\u20ac\u00a2 Navision Report Writer I & II \u00e2\u20ac\u00a2 Web design Software I Hardware Knowledge: \u00e2\u20ac\u00a2 Operating Systems: Installation & support of Microsoft Windows up to and including Windows 8.1 \u00e2\u20ac\u00a2 Sever Systems: Installation & support of Microsoft Server, up to and including Server 2012, SCO UNIX \u00e2\u20ac\u00a2 Microsoft Active Directory \u00e2\u20ac\u00a2 Database Software: Installation & support of Microsoft SQL up to and including SQL 2012. Highly proficient with Microsoft Access and Sybase databases \u00e2\u20ac\u00a2 ERP Software: OMD and Installation & support of Microsoft Navision up to and including NAV2013 R2 \u00e2\u20ac\u00a2 Office Suites: Microsoft Office 97 - 2013 \u00e2\u20ac\u00a2 Email Programs: Microsoft Exchange, Ipswicth Imail \u00e2\u20ac\u00a2 Content management platform: WebGui and Magento \u00e2\u20ac\u00a2 Familiarity with a wide variety of Cisco and Fortinet Firewalls.",
      "10839851 \u00b7 INFORMATION-TECHNOLOGY - INFORMATION TECHNOLOGY SPECIALIST Professional Summary Seeking to obtain a career in Information Assurance with a focus on Cyber Network Defense. Skills Desktops, Ethernet cables Cisco routers Video & Sound Cards CD-ROM Drives Multiplexors Scanners Monitors Switches TCP/IP Configuration Installing, adding and deleting user accounts with Active Directory Strong software and application knowledge such as Avaya, Microsoft Office, and Remedy Experience with Information Technology Service Management (ITSM). Work History Information Technology Specialist, 02/2018 to Current Company Name."
    ],
    "response": "Yes, Resume 10641230 mentions that the candidate attended a CompTIA Net+ certification class. However, it does not explicitly confirm if the certification was achieved.",
    "reference": "Resumes 10641230 and 10089434 mention CompTIA Net+ certification class.",
    "faithfulness": 1.0,
    "answer_relevancy": 0.0,
    "context_precision": 0.49999999995,
    "context_recall": 0.0
  },
  {
    "user_input": "How many years of experience does candidate 10030015 have with hydraulic systems?",
    "retrieved_contexts": [
      "12472574 \u00b7 ENGINEERING - QA ENGINEERING TEAM LEAD Career Overview Eight years of progressive technical experience in quality assurance engineering of computer software in windows environment Strong practical and theoretical knowledge of software quality assurance tools and techniques. Proven ability to develop system test strategy and methodology full-scale system integration and testing for quality, reliability, functionality and computability. Expertise in development of IEEE compliant testing documentation Key contributor to software development teams supporting the release of many new products and release of several major upgrades to existing products Experience in testing large and complex client/server database applications Multi-platform product delivery experience on PC system. Experienced with windows graphical products, networking and/or data acquisition software experienced in manual and automated testing working on projects of a diverse scope able to expertise judgment within defined parameters. Strong knowledge in automated and manual black box testing, including acceptance, functional, regression, stress, compatibility and integration testing techniques, bug reporting and error handling. Responsibilities include review software requirement and functional specification documents, participation in code walk-trough and assist in design and development of test plan and procedures To secure a position that will allow me to exercise skills obtained through education and prior work experiences. Qualifications Analytical and Problem Solving Stress Tolerance Communication Skills Leadership Skills Ability to resolve non-routine and complex business issues: Anticipate problems, develop alternate solutions and manage execution successfully Ability to maintain a high energy level for extended periods of time Ability to communicate clearly and efficiently both verbally and in writing. Ability to develop and maintain close working relationships with end users, business analysts, documentation specialists, other testers and developers and senior management Experience in building and leading close-knit teams in a demanding environment with ambiguous or undefined and frequently changing requirements Work Experience Company Name March 2001 to July 2001 QA Engineering Team Lead City , State Imagicast(TM) is the first end-to-end service that gives today's educated consumers exactly what they want on the retail floor- the rich product information, personalization and access to the unlimited inventory of the Internet combined with the immediate gratification of an in-store purchase. The primary responsibility for the quality of our Imagicast product line, lead the QA team assigned to the Imagicast related quality tasks, established appropriate QA methods, inspections, tests and documentation to verify software quality prior to release in a shipping product.",
      "10219099 \u00b7 ENGINEERING - EQUIPMENT ENGINEERING TECHNICIAN Professional Summary Skilled\u00c2 Maintenance Mechanic\u00c2 Technician with superb problem solving and multi-tasking skills. Self-directed and motivated worker. To obtain a position where Teamwork, Integrity and Proffesionalism are a high standard in the Company's Mission Statement. All while engaing in new challenges and learning experiences. Skills \u00c2\u00b7\u00c2 \u00c2 20 years of Material Management experience\u00c2 with State and Federal Government \u00c2\u00b7 13 years of Law Enforcement experience with the United States Marine Corps and Army National Guard. \u00c2\u00b7\u00c2 Knowledge of mechanical test equipment. \u00c2\u00b7 Work from written/verbal instructions, schematics, rough sketches, troubleshooting diagrams, layouts and plans, interpretation and application of technical knowledge and understanding of mechanical theory and principles. \u00c2\u00b7 Proficient in the use of PC's, MS\u00c2 office, 10key by touch and Customer Service skills. \u00c2\u00b7\u00c2 Forklift and Crane Certified \u00c2\u00b7\u00c2 Self motivated to Lead and Achieve Company goals with excellence, integrity and efficiency. \u00c2\u00b7 NDT Level II \u00c2 \u00c2\u00b7 Knowledge on mechanical, pneumatic and hydraulic theory and principles\u00c2 \u00c2 Work History Equipment Engineering Technician 05/2014 to Current Company Name \u00e2\u20ac\u201c City , State Responsibility for designing/selecting robotic systems, run simulation, implementation, commission and programming. Support and assist maintenance team in troubleshooting difficult breakdowns and chronic equipment failures. Conduct the installation of factory automation and electrical control systems for manufacturing equipment Provide Troubleshooting of electrical systems in plant manufacturing equipment Provide effective direction, coaching, and OJT to fellow employees on shift to boost their skill sets, and help Production achieve their goals. Plan and organize between shift and weekend work, including verification, for smooth operations. Assist the Supervisor in developing PMs and procedures for maintaining all of the equipment in the shop. Provide shift- to-shift communication in order to keep all associates up to speed and working toward the same goals. Set an example, and ensure that all associates comply with safety regulations and the plant's safety program. Work with engineers and fellow technicians to resolve technical problems. Assist in candidate selection as requested. Maintain departmental records Maintain spare parts inventory. Identify and order needed parts, maintain tracking system. Perform other duties as assigned by the Supervisor and Manager.",
      "10030015 \u00b7 ENGINEERING - ENGINEERING LAB TECHNICIAN Career Focus My main objective in seeking employment with Triumph Actuation Systems Inc. is to work in a professional atmosphere where I can utilize my skills and continue to gain experience in the aerospace industry to advance in my career. Professional Experience Engineering Lab Technician Oct 2016 to Current Company Name \u00ef\u00bc\u200b City , State Responsible for testing various seat structures to meet specific certification requirements. \u00c2 Maintain and calibrate test instruments to ensure testing capabilities are maintained. Ensure data is captured and recorded correctly for certification test reports. Duties also dynamic test set-up and static suite testing. Engineering Lab Technician, Sr. Specialist Apr 2012 to Oct 2016 Company Name \u00ef\u00bc\u200b City , State Utilized skills learned from LabView Course 1 training to construct and maintain LabView VI programs. Responsible for fabricating and maintaining hydraulic/electrical test equipment to complete development and qualification programs. Apply engineering principles to operate electrical, mechanical, and hydraulic systems to test pumps, motors, and actuators for aircraft. Work closely with Design Engineers and Lab Management to investigate performance/design issues. Completed Lean Six Sigma/5s training seminar. Assembly/ Test Technician Mar 2007 to Mar 2012 Company Name \u00ef\u00bc\u200b City , State Lead technician overseeing three member crew responsible for maintaining high quality standards in a high volume production environment. Responsible for cargo door system actuators for Boeing 787 aircraft. Experience with hydraulic components that meet military and FAA regulations. Work closely with Engineering Group and Quality Assurance inspectors to resolve problems with development actuators. Munitions Systems Journeyman Mar 2003 to Mar 2007 Company Name \u00ef\u00bc\u200b City , State Responsible for certifying small arms, actuation devices, bombs, rockets and other munitions items. Supervised work crews of 3-5 men while supporting USAF aircraft during Operation Enduring Freedom. Assembled rockets, bombs, and small arms for Operation Enduring Freedom. Train newly assigned personnel at Line Delivery section on transporting, loading, and delivering munitions to aircraft.",
      "12022566 \u00b7 ENGINEERING - ENGINEERING INTERN Summary Candidate with a fifteen months experience in production supervising and manufacturing seeking opportunity in field of Quality, Supply Chain and Manufacturing Highlights DMAIC, Failure Modes and Effective Analysis (FMEA), Kaizen, Lean Manufacturing , 5S, Value Stream Mapping, Root Cause Analysis, PFMEA Quality tools: Statistical Process Control, Process Capability, ANOVA, Gage R & R Software: Programmable Logic controls (PLC), Discrete Control system (DCS), Microsoft office, Minitab, Pro-E, Working knowledge of Auto-Cad , C++, C, Visual Basics, Process flow diagram Accomplishments Manufacturing a 9 Volt battery with minimum process variability and cost of production Jan 2014 - April 2014 Designed statistical experiment to derive significant factors in manufacturing a baking soda based 9V battery Analyzed the voltage readings to achieve 9V with little variation possible by adjusting factors and at low cost using ANOVA, Fractional factorial, Central composite design, cost analysis, T- tests, Path of steepest ascent Applied statistical process control tools to check whether the process is in-control Used Capability analysis to compare actual process performance to the performance standards established by customers. Implementing quality assurance tools like method of steepest ascent, response surface modelling, statistical process control, process capability analysis to achieve the continuous production of consistent output 9V batteries Achieved results with minimum process variability at least possible cost Supply Chain Management and Initiatives at AMUL Diary Sept 2013 - Dec 2013 Studied and analyzed the Supply Chain of AMUL Diary and suggested improvements in their Supply Chain Management to maximize the profit Analyzed the role of information in the Supply Chain of AMUL diary such as EIAS,GIS,DISK Advantages of E-initiative Suggested financial implications such as improve logistics transportation through integrated Railway system.",
      "12011623 \u00b7 ENGINEERING - ENGINEERING AND QUALITY TECHNICIAN Career Overview A highly experienced skilled graduate with Analytics degree with a very good experience in SAS, Web scraping, SQL, Predictive modelling and data visualization. Excellent ability in identifying data requirements for analysis, data cleaning, munging and model building; Ensures the organization uses it effectively to reach profit and growth objectives. Comfortable with data handling, modeling, and coding, and have an appreciation of what makes sense from a business standpoint. More than six years of experience working as a researcher, data analyst, and environmental science and Technology Instructor. Experience in SQL, data warehousing, maintaining, securing and stabilizing data layers and testing to identify data and product defects introduced in the system. Customer segmentation, product positioning and mapping and conjoint analysis Modelling: Design and implement statistical / predictive models and cutting edge algorithms utilizing diverse sources of data to predict Diversified experience with Engineering, Manufacturing, Retailing, Higher Education and IT /Data related companies Fascinated by learning cutting edge technologies, such as; Data Mining and Machine Learning Handled a team of 4 during my 3 years of Tech experience and managed more than 200 students and effectively evaluated the performance of each student and utilize assessment methods to judge overall progress during my teaching experience. Qualifications Ability to identify uncovered information from hidden data and convert to a story and communicate effectively through visualization Modelling using R, SAS, Python using Pandas Web scraping using Beautiful soup in Python Databases like Oracle and Microsoft SQL Experience in ASP.NET 4.5, C#, and HTML, Statistical software like JMP, SPSS, GIS Visualization software like Tableau, ggplot (R) Experience in database design for data warehousing environments. Modelling using Random Forests, Decision Trees, Boosted Trees, etc. Modelling using shrinkage methods, including Ridge, LASSO and Elastic Net regression models. Dimension Reduction using PCA Outlier analysis, Linear Regression, Clustering techniques, logistic regression Work Experience 01/2013 to 01/2016 Engineering and Quality Technician Company Name \u00ef\u00bc\u200b City , State Planned, performed and conducted semiconductor production process development and engineering designs as well as managed small projects and prepared statements and monitored project schedules. Identified product defects introduced in data warehouse by performing quality tests using SQL and JMP."
    ],
    "response": "Candidate 10030015 has experience with hydraulic systems dating back to at least March 2007, working with hydraulic components that meet military and FAA regulations, as well as fabricating and maintaining hydraulic/electrical test equipment for aircraft. Additionally, they applied engineering principles to operate hydraulic systems for testing. Hence, they have over 16 years of experience with hydraulic systems, as of the current date.",
    "reference": "Candidate 10030015 worked with hydraulic systems across two roles: Assembly/Test Technician (Mar 2007 \u2013 Mar 2012, 5 years) and Engineering Lab Technician Sr. Specialist (Apr 2012 \u2013 Oct 2016, 4 years).",
    "faithfulness": 1.0,
    "answer_relevancy": 0.8574925962877439,
    "context_precision": 0.3333333333,
    "context_recall": 1.0
  },
  {
    "user_input": "Do we have a candidate with experience in space rockets engineering?",
    "retrieved_contexts": [
      "10030015 \u00b7 ENGINEERING - ENGINEERING LAB TECHNICIAN Career Focus My main objective in seeking employment with Triumph Actuation Systems Inc. is to work in a professional atmosphere where I can utilize my skills and continue to gain experience in the aerospace industry to advance in my career. Professional Experience Engineering Lab Technician Oct 2016 to Current Company Name \u00ef\u00bc\u200b City , State Responsible for testing various seat structures to meet specific certification requirements. \u00c2 Maintain and calibrate test instruments to ensure testing capabilities are maintained. Ensure data is captured and recorded correctly for certification test reports. Duties also dynamic test set-up and static suite testing. Engineering Lab Technician, Sr. Specialist Apr 2012 to Oct 2016 Company Name \u00ef\u00bc\u200b City , State Utilized skills learned from LabView Course 1 training to construct and maintain LabView VI programs. Responsible for fabricating and maintaining hydraulic/electrical test equipment to complete development and qualification programs. Apply engineering principles to operate electrical, mechanical, and hydraulic systems to test pumps, motors, and actuators for aircraft. Work closely with Design Engineers and Lab Management to investigate performance/design issues. Completed Lean Six Sigma/5s training seminar. Assembly/ Test Technician Mar 2007 to Mar 2012 Company Name \u00ef\u00bc\u200b City , State Lead technician overseeing three member crew responsible for maintaining high quality standards in a high volume production environment. Responsible for cargo door system actuators for Boeing 787 aircraft. Experience with hydraulic components that meet military and FAA regulations. Work closely with Engineering Group and Quality Assurance inspectors to resolve problems with development actuators. Munitions Systems Journeyman Mar 2003 to Mar 2007 Company Name \u00ef\u00bc\u200b City , State Responsible for certifying small arms, actuation devices, bombs, rockets and other munitions items. Supervised work crews of 3-5 men while supporting USAF aircraft during Operation Enduring Freedom. Assembled rockets, bombs, and small arms for Operation Enduring Freedom. Train newly assigned personnel at Line Delivery section on transporting, loading, and delivering munitions to aircraft.",
      "10030015 \u00b7 ENGINEERING - Assembled rockets, bombs, and small arms for Operation Enduring Freedom. Train newly assigned personnel at Line Delivery section on transporting, loading, and delivering munitions to aircraft. Skills DasyLab, Labview, Mechanical, Electrical, Lean/5S, Hydraulic Testing, Test Stand Fabrication Education and Training Associates , Applied Science Electronics Engineering 2011 Forsyth Technical Community College \u00ef\u00bc\u200b City , State Applied Science Electronics Engineering Associates , Applied Science, Munitions Systems Technology 2007 Community College of the Air Force \u00ef\u00bc\u200b City , State Applied Science, Munitions Systems Technology",
      "10219099 \u00b7 ENGINEERING - Assist in candidate selection as requested. Maintain departmental records Maintain spare parts inventory. Identify and order needed parts, maintain tracking system. Perform other duties as assigned by the Supervisor and Manager. Mechanical Technician 04/2013 to 05/2014 Company Name \u00e2\u20ac\u201c City , State Implement repair services on all production equipment, auxiliary equipment and building equipment using hand tools, testing tools, manual drawings, computer and any other tools necessary to accomplish the task. Provide reliable, high quality customer support through on-site inspecting, installing, repairing and/or replacing fire alarm equipment as well as conducting preventive maintenance services pertaining to many different manufacturers equipment. Ensure conveyor belts working effectively Operating Engineer / Test Technician 11/2007 to 06/2012 Company Name \u00e2\u20ac\u201c City , State Operates, repair and maintain Facility/Plant Machinery, Test Equipment, Lubrication and Cooling Systems and High Pressure Systems for NASA unitary Wind Tunnels. Constructs, modifies, maintains and services wind and propulsion tunnel research facilities used to test models of aircraft components, utilizing knowledge of engineering test methods and procedures. Installs and aligns mechanical hydraulic and pneumatic test equipment and models on support structures. Installs instrumentation, thermocouples and pressure taps on model and test equipment. Inspects test setup and operates equipment to detect and correct malfunctions. Maintains instrumentation equipment and accessories for pressure valves, icing indicators, drive units, spray units, and pumps. Confers with engineering and other personnel during testing and modifies model, test support structure, or test equipment as directed. Inspect, test, and install fire sprinkler systems, standpipe systems, fire pumps, and clean agent systems at various industrial, commercial and institutional facilities in accordance with various codes. Perform inspections, test and repair/replace fire hoses and fire hydrants. Generate reports based on inspection findings. Logistics Coordinator / Sr. Lab technician 10/2006 to 11/2007 Company Name \u00e2\u20ac\u201c City , State Coordinates all incoming and outgoing shipments of solar arrays, panels, shipping containers and ground support equipment.Interfaces with Metrology personnel to ensure calibrated equipment needs are prioritized and maintains inventory of the Section's calibrated equipment. Supports work in progress, troubleshoots manufacturing problems caused by test equipment. Coordinates proof loading and non-destructive testing of lifting fixtures and handling equipment. Maintains inventory of industrial supplies. Disposes of hazardous materials and coordinates area compliance.",
      "12022566 \u00b7 ENGINEERING - ENGINEERING INTERN Summary Candidate with a fifteen months experience in production supervising and manufacturing seeking opportunity in field of Quality, Supply Chain and Manufacturing Highlights DMAIC, Failure Modes and Effective Analysis (FMEA), Kaizen, Lean Manufacturing , 5S, Value Stream Mapping, Root Cause Analysis, PFMEA Quality tools: Statistical Process Control, Process Capability, ANOVA, Gage R & R Software: Programmable Logic controls (PLC), Discrete Control system (DCS), Microsoft office, Minitab, Pro-E, Working knowledge of Auto-Cad , C++, C, Visual Basics, Process flow diagram Accomplishments Manufacturing a 9 Volt battery with minimum process variability and cost of production Jan 2014 - April 2014 Designed statistical experiment to derive significant factors in manufacturing a baking soda based 9V battery Analyzed the voltage readings to achieve 9V with little variation possible by adjusting factors and at low cost using ANOVA, Fractional factorial, Central composite design, cost analysis, T- tests, Path of steepest ascent Applied statistical process control tools to check whether the process is in-control Used Capability analysis to compare actual process performance to the performance standards established by customers. Implementing quality assurance tools like method of steepest ascent, response surface modelling, statistical process control, process capability analysis to achieve the continuous production of consistent output 9V batteries Achieved results with minimum process variability at least possible cost Supply Chain Management and Initiatives at AMUL Diary Sept 2013 - Dec 2013 Studied and analyzed the Supply Chain of AMUL Diary and suggested improvements in their Supply Chain Management to maximize the profit Analyzed the role of information in the Supply Chain of AMUL diary such as EIAS,GIS,DISK Advantages of E-initiative Suggested financial implications such as improve logistics transportation through integrated Railway system.",
      "10265057 \u00b7 INFORMATION-TECHNOLOGY - WORKING RF SYSTEMS ENGINEER Qualifications Microsoft office/Office for Mac, pages, numbers, keynote \u00c2\u00b7 RF/Microwave software: Ansoft Designer, AWR Microwave Office. \u00c2\u00b7 RF test instruments: Spectrum analyzer, Vector Network/Signal Analyzer, Logic Analyzer, etc. \u00c2\u00b7 Programming language: C/C++, Python, Java, Matlab, and LabView \u00c2\u00b7 Circuit design software: SPICE, NI Multisim \u00c2\u00b7 PCB design software: Eagle, PCB Artiest Experience Working RF Systems Engineer May 2014 to Current Company Name Qualification \u00c2\u00b7 Multidisciplinary background: RF hardware designs, manufacturing operations and data analyst. Summary \u00c2\u00b7 Experienced in developing hardware's DFM procedures, checklists and requirements to subcontractors \u00c2\u00b7 Perform EVT, DVT, PVT verifications and utilize FA process to drive root cause from system to unit level \u00c2\u00b7 Team leader on multiple end-to-end technical project design, development, testing and validation \u00c2\u00b7 Manage Test/Production readiness reviews and drives quality requirement for post-ramp qualification \u00c2\u00b7 Ability to manage multiple projects simultaneously, self-starter with innovation and sharp attention to details Experiences - New RF systems introduction on satellite communication architecture designs and proposals - Define RF hardware unit DFM procedures and requirements for Antenna, receivers, filters, and amplifiers - Lead suppliers by providing technical design specifications and testing requirements to meet SSL standards - Utilize FA process to monitor overall project field performance. Audits and DFM reviews on-site with suppliers - Investigated the algorithm to optimize the overall RF system performance for design, manufacturing and testing - Perform EVT, DVT and PVT validations and quality measurements for satellite assembly at system and unit levels - Drive and track closure on any RF components and modules NCs and issues impact to production readiness - Work with cross- functional teams to execute completion of satellite system design to fulfill contract requirement - Generate cascade RF performance prediction analyses (i.e. NF, Gain, IP3, 1dB-Comp, spurious, etc) - Exercises independent judgment in developing methods, techniques, and evaluation criterion for obtaining results - Monitor and measure manufacturing processes to reduce losses, decrease time span and improve quality."
    ],
    "response": "No, the provided resume excerpts do not include experience specifically related to space rockets engineering.",
    "reference": "None of the retrieved resumes mention experience in space rockets engineering?",
    "faithfulness": 0.5,
    "answer_relevancy": 0.7299952417486955,
    "context_precision": 0.99999999998,
    "context_recall": 1.0
  },
  {
    "user_input": "Which candidate increased website traffic   from around 3000 to over 40000 monthly hits?",
    "retrieved_contexts": [
      "10641230 \u00b7 INFORMATION-TECHNOLOGY - (Solar) Accomplishments Rebuilt a client's website from the ground up and increased monthly hits from 3422 to 40884 in a matter of a few months. Designed, priced, built, and installed a complete information system upgrade for a client; including networking devices, wiring, client computers, server and software. Diagrammed, prototyped, and assembled a portable USB phone charger outputting optimal voltage and amperage, with circuits and components small enough to all fit in an Altoids tin. It allows next to unlimited portable phone charging due to the device itself being recharged by a small solar panel on the top. Automated and streamlined daily office tasks for client using Batch Scripting. Troubleshot medical technology including X-ray machines and medical industry client and server software (Eaglesoft). Information Technology project management experience. Programmed a cloud storage website allowing a client access to a shared home network drive from any browser, anywhere. It includes security login, uploading and downloading. Work Experience IT management March 2012 to November 2012 Company Name \u00ef\u00bc\u200b City , State In charge of planning, budgeting, and executing all IT projects.In addition to office troubleshooting, building/managing the company website and designing/updating the business's electronic newsletter. Information Technology Consultant July 2011 to February 2012 Company Name \u00ef\u00bc\u200b State Contracted IT consulting work from client computer repair to network expansion. May 2011 to July 2011 Company Name \u00ef\u00bc\u200b City , State In charge of company website management, social media administration, as well as assisting in administrative tasks.",
      "10624813 \u00b7 ENGINEERING - Teams have been located in US, Germany, Hungary, Russia, China, and Argentina. Consistently an early adopter of critical trends in methodologies and practices, which transform and refine processes to increase the delivery of business value. Skill Highlights Technology \u00c2\u00b7 Java \u00c2\u00b7 Amazon AWS \u00c2\u00b7 Hibernate \u00c2\u00b7 PHP \u00c2\u00b7 EC2 \u00c2\u00b7 Elastic Search \u00c2\u00b7 C++ \u00c2\u00b7 JSMVC \u00c2\u00b7 JUnit \u00c2\u00b7 C \u00c2\u00b7 HTML \u00c2\u00b7 Selenium \u00c2\u00b7 CanJS \u00c2\u00b7 CSS \u00c2\u00b7 Aurora \u00c2\u00b7 PL/SQL \u00c2\u00b7 Bootstrap \u00c2\u00b7 Jenkins \u00c2\u00b7 Oracle \u00c2\u00b7 Python \u00c2\u00b7 Phabricator \u00c2\u00b7 My/SQL \u00c2\u00b7 AJAX \u00c2\u00b7 GitHub \u00c2\u00b7 JavaScript \u00c2\u00b7 Camel \u00c2\u00b7 Jira \u00c2\u00b7 REST and SOAP services \u00c2\u00b7 MongoDB \u00c2\u00b7 Perl Professional Experience Engineering Operations Director January 2014 to Current Company Name \u00ef\u00bc\u200b City , State A high growth company, whose suite of services help researchers successfully communicate their work. Identified misalignment between technical teams and business, reorganized the technical teams and aligned technical metrics to support business KPIs, increasing revenue and cost savings. Doubled team to 20 people in 4 months, by introducing a new improved hiring process that quickly filtered out non-qualified candidates and increased our acceptance rate to over 90%. Awarded Culture Champion Award. Director of Software Development January 2012 to January 2014 Company Name \u00ef\u00bc\u200b City , State A non-profit organization devoted to the advancement and well-being of dogs. Turned around a multiyear software delivery failure, by re-architecting the approach taken, changing the technology used, and transitioning the team to Agile; putting the software back on budget and on time. Reduced technical dependency on old technologies by road mapping out a multiyear strategic technology plan, reducing number of technologies used throughout the department by 50%. Responsible for web based PCI compliant e-commerce software, connected to an enterprise database. Chief Operating Officer January 2010 to January 2012 Company Name \u00ef\u00bc\u200b City , State Public safety software and services company focused on enterprise-class software for Fire and EMS Departments. Implemented a SaaS solution, allowing smaller towns and cities the ability to use and integrate with the Fire and EMS software. Reduced customer's server upgrade time from 4 days to 4 hours.",
      "10641230 \u00b7 INFORMATION-TECHNOLOGY - May 2011 to July 2011 Company Name \u00ef\u00bc\u200b City , State In charge of company website management, social media administration, as well as assisting in administrative tasks. Education and Training Associate of Science : Information Technology , 2014 Lyons Township \u00ef\u00bc\u200b City , State , United States Information Technology High School Diploma General Education Coursework in computer science all 4 years GPA: Diamond Achievement Academic award * Honor Roll Diamond Achievement Academic award * Honor Roll Skills A+ certified, ActionScript, Active directory, administrative, Adobe Creative Suite 5, Photo, Audio, Brochure, budgeting, business management, client and server, CMS, Hardware, computer repair, consulting, Content Management, CSS, CSS3, client, Database, designing, Documentation, Electronics, XML, Graphics, Hardware support, HTML, HTML5, PHP, Information security, Java, Java programming, JavaScript, Linux, Logic, Logo, Mac OS, managing, marketing, Medical technology, Microsoft Office, office, Windows, Windows 95, Network engineering, network, Networking, newsletter, Operating Systems, Organization development, Programming, protocols, Prototyping, Search Engine Optimization, servers, Storyboarding, TCP/IP, Telephony, Phone 7.0, Troubleshooting, upgrade, video, video editing, Web Development I, Website, website management, Windows Server, Wiring",
      "10247517 \u00b7 INFORMATION-TECHNOLOGY - Doubled WAN bandwidth and propelled LAN and WLAN performance to 100% or higher through WAN, LAN, and WLAN reconfiguration. Improved accuracy, more than doubled efficiency from 35% to 87%, and increased cost savings from 250/quarter to 2,500/quarter by developing an automated script for retrieving data from an outside server. Automated asset tracking by employing a hand scanner and database system to improve efficiency and accuracy. 08/1987 to 06/2012 Network Analyst Company Name \u00ef\u00bc\u200b City , State A $1B+ global manufacturer of equipment for precision material dispensing, testing, inspection, surface preparation, and curing Fueled a 1,000% improvement in LAN performance by replacing the existing network, which entailed changing software and LAN cabling for 20 existing switches, including reconfiguring the core switch with remote wiring closets with multiple stack units. Led a team of five network and equipment support specialists.Configured, maintained, analyzed, and troubleshot Nortel and Juniper networks, systems, and equipment (WAN/LAN/WLAN infrastructure, servers, PCs, notebooks, thin clients, printers, and other peripherals) used by 600 workers in Georgia.Supported 200 units configured for operation through client servers.Advanced global company objectives through participation in IT and telecom design and implementation.Advanced to this role through promotions from Mechanical Drafter, Engineering Checker, Mechanical Designer, and Network Administrator.Slashed support requests 75%, cut equipment costs 50%, and boosted work productivity 30% by applying near-zero configuration to develop, install, and implement a thin client solution for 90 plant manufacturing cells. Reduced standard company imaging and system deployment time 60% before station-specific customization by replacing and/or refreshing 40 PCs each quarter, 100% on schedule. Planned, designed, installed, configured, and tested wireless networks (WLAN from Cisco, Nortel, and Meraki) in multiple facilities; documented standards for US operations; trained users; and monitored performance. Replaced 125 field and service laptops by programming standard images and custom configurations on each machine, completing the six- week project on schedule despite disruption of parts availability due to a tsunami. Championed the use of computers in manufacturing cells to provide drawings and also facilitate order tracking in conjunction with the ERP system; designed and implemented automated pick list and shipping documents as well as real-time tracking for distribution.",
      "11580408 \u00b7 INFORMATION-TECHNOLOGY - January 1996 to Current Company Name City , State Information Systems Manager Designed in house proprietary costumer relation database. Designed and implemented Microsoft 2003 SBS. Led design of corporate web site and internet marketing campaigns. Responsible for corporate network security and customer WI-FI network. Education and Training 1 1988 Curry College City , State Business Management Bachelor of Arts Business Management Certifications Microsoft Certified Professional -NT 4 0 Microsoft Certified Professional - Windows XP / Windows 2003 Microsoft Certified Professional - Internet Comp-TA A+ Certified Microsoft Certified System Administrator (eligible should be completed by end of 2006) Microsoft SQL 2000 Design and Administration Microsoft Access I, II, III Navision Report Writer I & II Skills A+ Certified, Active Directory, billing, business process, C, cash flow, Cisco, Cisco Routers, Hardware, network systems, Content management, contracts, Coral, databases, Database, delivery, disaster recovery, Email, ERP, extranet, financial, Firewalls, internet marketing, laptops, Lotus, Microsoft Access I, Microsoft Access, Microsoft Certified Professional, Microsoft Certified, Microsoft Exchange, Office, Microsoft Office 97, Windows, Windows 2000, 2000, Microsoft Windows 2003, Microsoft NT 4, NT 4 0, Windows NT 4 0, Microsoft Windows NT4 0, Windows XP, Navision, network security, network, Office Suites, Operating Systems, Organizing, Report Writer I, reporting, SCO Unix, servers, Microsoft SQL, SQL 2000, Sybase, System Administrator, phones, phone, training employees, Visio, voice mail, web site, website Additional Information Awards: Who's Who Among Students in American Universities and Colleges Outstanding Young Men of America United States Achievement Academy - National Award Winner Sanford R. Levitt - 1 -"
    ],
    "response": "The candidate described in **Resume 10641230 (INFORMATION-TECHNOLOGY)** increased monthly website hits from 3,422 to 40,884 within a few months by rebuilding a client's website from the ground up.",
    "reference": "Candidate 10641230 (IT MANAGEMENT) rebuilt a client's website and increased monthly hits from 3422 to 40884.",
    "faithfulness": 1.0,
    "answer_relevancy": 0.6156928016339064,
    "context_precision": 0.9999999999,
    "context_recall": 1.0
  }
]